{
  "schema_version": 2,
  "work_id": "saki-the-open-window",
  "segment_ids": [
    "saki-the-open-window:1.1",
    "saki-the-open-window:1.2",
    "saki-the-open-window:1.3",
    "saki-the-open-window:1.4",
    "saki-the-open-window:1.5",
    "saki-the-open-window:1.6",
    "saki-the-open-window:1.7",
    "saki-the-open-window:1.8",
    "saki-the-open-window:1.9",
    "saki-the-open-window:1.10",
    "saki-the-open-window:1.11",
    "saki-the-open-window:1.12",
    "saki-the-open-window:1.13",
    "saki-the-open-window:1.14",
    "saki-the-open-window:1.15",
    "saki-the-open-window:1.16",
    "saki-the-open-window:1.17",
    "saki-the-open-window:1.18",
    "saki-the-open-window:1.19",
    "saki-the-open-window:1.20",
    "saki-the-open-window:1.21",
    "saki-the-open-window:1.22",
    "saki-the-open-window:1.23",
    "saki-the-open-window:1.24",
    "saki-the-open-window:1.25",
    "saki-the-open-window:1.26",
    "saki-the-open-window:1.27",
    "saki-the-open-window:1.28",
    "saki-the-open-window:1.29"
  ],
  "deprecated_ids": {},
  "notes": "Canonical units follow every prose paragraph in the selected complete electronic witness. The title is edition metadata; surrounding editorial notes, headings and navigation are excluded. Passage IDs are immutable and may not be reassigned."
}
